{
  "bodyTypeName": "male",
  "url": "https://sanderfrenken.github.io/Universal-LPC-Spritesheet-Character-Generator/#?body=Body_color_olive&head=Human_male_olive&hair=Part2_gray&clothes=Collared_longsleeve_formal_striped&legs=Pantaloons_maroon&shoes=Armour_iron&eyes=Eyes_gray&sex=male&cape=none&shoulders=none&jacket=Collared_coat_tan",
  "spritesheets": "https://sanderfrenken.github.io/Universal-LPC-Spritesheet-Character-Generator/spritesheets/",
  "version": 1,
  "datetime": "10/22/2023, 8:48:08 PM",
  "credits": "Authors: bluecarrot16, Benjamin K. Smith (BenCreating), Evert, Eliza Wyatt (ElizaWy), TheraHedwig, MuffinElZangano, Durrani, Johannes Sj?lund (wulax), Stephen Challener (Redshrike), Mark Weyer, Johannes Sjölund (wulax), Matthew Krohn (makrohn), Skorpio, Thane Brimhall (pennomi), laetissima, Nila122\n\n- body/bodies/male/universal/olive.png: by bluecarrot16, Benjamin K. Smith (BenCreating), Evert, Eliza Wyatt (ElizaWy), TheraHedwig, MuffinElZangano, Durrani, Johannes Sj?lund (wulax), Stephen Challener (Redshrike). License(s): CC-BY-SA 3.0, GPL 3.0. \n    - https://opengameart.org/content/liberated-pixel-cup-lpc-base-assets-sprites-map-tiles\n    - https://opengameart.org/content/lpc-medieval-fantasy-character-sprites\n    - https://opengameart.org/content/lpc-male-jumping-animation-by-durrani\n    - https://opengameart.org/content/lpc-runcycle-and-diagonal-walkcycle\n    - https://opengameart.org/content/lpc-revised-character-basics\n\n- head/heads/human_male/universal/olive.png: by bluecarrot16, Benjamin K. Smith (BenCreating), Stephen Challener (Redshrike). License(s): OGA-BY 3.0, CC-BY-SA 3.0, GPL 3.0. \n    - https://opengameart.org/content/liberated-pixel-cup-lpc-base-assets-sprites-map-tiles\n    - https://opengameart.org/content/lpc-character-bases\n\n- eyes/male/gray.png: by Mark Weyer, Johannes Sjölund (wulax), Matthew Krohn (makrohn), Stephen Challener (Redshrike). License(s): CC-BY-SA 3.0, GPL 3.0. \n    - https://opengameart.org/content/liberated-pixel-cup-lpc-base-assets-sprites-map-tiles\n    - https://opengameart.org/content/lpc-medieval-fantasy-character-sprites\n\n- hair/part2/male/gray.png: by Skorpio, bluecarrot16. License(s): CC-BY-SA 3.0, GPL 3.0. \n    - https://opengameart.org/content/lpc-skorpios-scifi-sprite-pack\n    - https://opengameart.org/content/lpc-hair\n\n- torso/clothes/longsleeve/male/formal_striped.png: by bluecarrot16, Thane Brimhall (pennomi), laetissima, Johannes Sjölund (wulax). License(s): CC-BY-SA 3.0, GPL 3.0. \n    - https://opengameart.org/content/lpc-medieval-fantasy-character-sprites\n    - https://opengameart.org/content/lpc-2-characters\n\n- torso/jacket/collared/male/tan.png: by bluecarrot16. License(s): CC-BY-SA 3.0, GPL 3.0. \n    - https://opengameart.org/content/lpc-gentleman\n    - https://opengameart.org/content/lpc-pirates\n\n- legs/pantaloons/male/maroon.png: by Nila122, Johannes Sjölund (wulax), Stephen Challener (Redshrike). License(s): CC-BY-SA 3.0, GPL 2.0, GPL 3.0. \n    - https://opengameart.org/content/lpc-pirates\n    - https://opengameart.org/content/more-lpc-clothes-and-hair\n\n- feet/armour/plate/male/iron.png: by Matthew Krohn (makrohn), Johannes Sjölund (wulax). License(s): CC-BY-SA 3.0, GPL 3.0. \n    - https://opengameart.org/content/lpc-medieval-fantasy-character-sprites",
  "layers": [
    {
      "fileName": "body/bodies/male/universal/olive.png",
      "zPos": 10,
      "parentName": "body",
      "name": "Body color",
      "variant": "olive"
    },
    {
      "fileName": "feet/armour/plate/male/iron.png",
      "zPos": 15,
      "parentName": "shoes",
      "name": "Armour",
      "variant": "iron"
    },
    {
      "fileName": "legs/pantaloons/male/maroon.png",
      "zPos": 20,
      "parentName": "legs",
      "name": "Pantaloons",
      "variant": "maroon"
    },
    {
      "fileName": "torso/clothes/longsleeve/male/formal_striped.png",
      "zPos": 35,
      "parentName": "clothes",
      "name": "Collared longsleeve",
      "variant": "formal striped"
    },
    {
      "fileName": "torso/jacket/collared/male/tan.png",
      "zPos": 55,
      "parentName": "jacket",
      "name": "Collared coat",
      "variant": "tan"
    },
    {
      "fileName": "head/heads/human_male/universal/olive.png",
      "zPos": 100,
      "parentName": "head",
      "name": "Human male",
      "variant": "olive"
    },
    {
      "fileName": "eyes/male/gray.png",
      "zPos": 105,
      "parentName": "eyes",
      "name": "Eyes",
      "variant": "gray"
    },
    {
      "fileName": "hair/part2/male/gray.png",
      "zPos": 120,
      "parentName": "hair",
      "name": "Part2",
      "variant": "gray"
    }
  ]
}