{
  "bodyTypeName": "male",
  "url": "https://sanderfrenken.github.io/Universal-LPC-Spritesheet-Character-Generator/#?body=Body_color_olive&head=Human_male_olive&hair=Spiked_porcupine_black&clothes=Sleeveless_male_charcoal&legs=Pants_black&shoes=Shoes_slate&eyes=Eyes_gray&sex=male&cape=none&shoulders=none&jacket=none&beard=none&hat=none&jacket_collar=none&vest=Vest_open_blue",
  "spritesheets": "https://sanderfrenken.github.io/Universal-LPC-Spritesheet-Character-Generator/spritesheets/",
  "version": 1,
  "datetime": "10/22/2023, 8:55:41 PM",
  "credits": "Authors: bluecarrot16, Benjamin K. Smith (BenCreating), Evert, Eliza Wyatt (ElizaWy), TheraHedwig, MuffinElZangano, Durrani, Johannes Sj?lund (wulax), Stephen Challener (Redshrike), Mark Weyer, Johannes Sjölund (wulax), Matthew Krohn (makrohn), Fabzy, David Conway Jr. (JaidynReiman), Marcel van de Steeg (MadMarcel), Nila122, Thane Brimhall (pennomi), laetissima, Joe White\n\n- body/bodies/male/universal/olive.png: by bluecarrot16, Benjamin K. Smith (BenCreating), Evert, Eliza Wyatt (ElizaWy), TheraHedwig, MuffinElZangano, Durrani, Johannes Sj?lund (wulax), Stephen Challener (Redshrike). License(s): CC-BY-SA 3.0, GPL 3.0. \n    - https://opengameart.org/content/liberated-pixel-cup-lpc-base-assets-sprites-map-tiles\n    - https://opengameart.org/content/lpc-medieval-fantasy-character-sprites\n    - https://opengameart.org/content/lpc-male-jumping-animation-by-durrani\n    - https://opengameart.org/content/lpc-runcycle-and-diagonal-walkcycle\n    - https://opengameart.org/content/lpc-revised-character-basics\n\n- head/heads/human_male/universal/olive.png: by bluecarrot16, Benjamin K. Smith (BenCreating), Stephen Challener (Redshrike). License(s): OGA-BY 3.0, CC-BY-SA 3.0, GPL 3.0. \n    - https://opengameart.org/content/liberated-pixel-cup-lpc-base-assets-sprites-map-tiles\n    - https://opengameart.org/content/lpc-character-bases\n\n- eyes/male/gray.png: by Mark Weyer, Johannes Sjölund (wulax), Matthew Krohn (makrohn), Stephen Challener (Redshrike). License(s): CC-BY-SA 3.0, GPL 3.0. \n    - https://opengameart.org/content/liberated-pixel-cup-lpc-base-assets-sprites-map-tiles\n    - https://opengameart.org/content/lpc-medieval-fantasy-character-sprites\n\n- hair/spiked_porcupine/male/black.png: by Fabzy, bluecarrot16. License(s): CC-BY-SA 3.0. \n    - https://opengameart.org/content/the-revolution-hair\n    - https://opengameart.org/content/lpc-hair\n\n- torso/clothes/sleeveless/male/charcoal.png: by bluecarrot16, Matthew Krohn (makrohn), David Conway Jr. (JaidynReiman), Marcel van de Steeg (MadMarcel), Nila122, Johannes Sjölund (wulax), Stephen Challener (Redshrike). License(s): CC-BY-SA 3.0. \n    - https://opengameart.org/content/lpc-female-orcogregoblintroll-base-walkcycle\n    - https://opengameart.org/content/lpc-curly-hair-elven-ears-white-cape-with-blue-trim-and-more\n    - https://opengameart.org/content/more-lpc-clothes-and-hair\n    - https://opengameart.org/content/lpc-pirates\n\n- torso/clothes/vest_open/male/blue.png: by bluecarrot16, Thane Brimhall (pennomi), laetissima. License(s): CC-BY-SA 3.0, GPL 3.0. \n    - https://opengameart.org/content/lpc-2-characters\n    - https://opengameart.org/content/lpc-gentleman\n    - https://opengameart.org/content/lpc-pirates\n\n- legs/pants/male/black.png: by bluecarrot16, David Conway Jr. (JaidynReiman), Joe White, Matthew Krohn (makrohn), Johannes Sjölund (wulax). License(s): CC-BY-SA 3.0, GPL 3.0. \n    - https://opengameart.org/content/liberated-pixel-cup-lpc-base-assets-sprites-map-tiles\n    - https://opengameart.org/content/lpc-medieval-fantasy-character-sprites\n\n- feet/shoes/male/slate.png: by bluecarrot16, Johannes Sjölund (wulax). License(s): CC-BY-SA 3.0, GPL 3.0. \n    - https://opengameart.org/content/lpc-medieval-fantasy-character-sprites\n    - http://opengameart.org/content/lpc-clothing-updates",
  "layers": [
    {
      "fileName": "body/bodies/male/universal/olive.png",
      "zPos": 10,
      "parentName": "body",
      "name": "Body color",
      "variant": "olive"
    },
    {
      "fileName": "feet/shoes/male/slate.png",
      "zPos": 15,
      "parentName": "shoes",
      "name": "Shoes",
      "variant": "slate"
    },
    {
      "fileName": "legs/pants/male/black.png",
      "zPos": 20,
      "parentName": "legs",
      "name": "Pants",
      "variant": "black"
    },
    {
      "fileName": "torso/clothes/sleeveless/male/charcoal.png",
      "zPos": 35,
      "parentName": "clothes",
      "name": "Sleeveless male",
      "variant": "charcoal"
    },
    {
      "fileName": "torso/clothes/vest_open/male/blue.png",
      "zPos": 45,
      "parentName": "vest",
      "name": "Vest open",
      "variant": "blue"
    },
    {
      "fileName": "head/heads/human_male/universal/olive.png",
      "zPos": 100,
      "parentName": "head",
      "name": "Human male",
      "variant": "olive"
    },
    {
      "fileName": "eyes/male/gray.png",
      "zPos": 105,
      "parentName": "eyes",
      "name": "Eyes",
      "variant": "gray"
    },
    {
      "fileName": "hair/spiked_porcupine/male/black.png",
      "zPos": 120,
      "parentName": "hair",
      "name": "Spiked porcupine",
      "variant": "black"
    }
  ]
}