{
    "bodyTypeName": "female",
    "url": "https://sanderfrenken.github.io/Universal-LPC-Spritesheet-Character-Generator/#?body=Body_color_amber&head=Human_female_amber&hair=Lob_black&clothes=none&legs=Pants_leather&shoes=Sandals_leather&eyes=Eyes_gray&sex=female&cape=none&shoulders=none&jacket=none&beard=none&hat=none&jacket_collar=none&vest=none&dress=Sash_dress_pink&apron=none&nose=Button_nose_amber&neck=none&sash=none&belt=none&ears=none&necklace=none",
    "spritesheets": "https://sanderfrenken.github.io/Universal-LPC-Spritesheet-Character-Generator/spritesheets/",
    "version": 1,
    "datetime": "10/23/2023, 12:22:19 PM",
    "credits": "Authors: Benjamin K. Smith (BenCreating), bluecarrot16, TheraHedwig, Evert, MuffinElZangano, Durrani, Pierre Vigier (pvigier), ElizaWy, Matthew Krohn (makrohn), Johannes Sjölund (wulax), Stephen Challener (Redshrike), Thane Brimhall (pennomi), Mark Weyer, laetissima, David Conway Jr. (JaidynReiman), Joe White, Nila122\n\n- body/bodies/female/universal/amber.png: by Benjamin K. Smith (BenCreating), bluecarrot16, TheraHedwig, Evert, MuffinElZangano, Durrani, Pierre Vigier (pvigier), ElizaWy, Matthew Krohn (makrohn), Johannes Sjölund (wulax), Stephen Challener (Redshrike). License(s): OGA-BY 3.0, CC-BY-SA 3.0, GPL 3.0. \n    - https://opengameart.org/content/liberated-pixel-cup-lpc-base-assets-sprites-map-tiles\n    - https://opengameart.org/content/lpc-medieval-fantasy-character-sprites\n    - https://opengameart.org/content/lpc-ladies\n    - https://opengameart.org/content/lpc-7-womens-shirts\n    - https://opengameart.org/content/lpc-jump-expanded\n\n- head/heads/human_female/universal/amber.png: by bluecarrot16, Benjamin K. Smith (BenCreating), Stephen Challener (Redshrike). License(s): OGA-BY 3.0, CC-BY-SA 3.0, GPL 3.0. \n    - https://opengameart.org/content/\n    - https://opengameart.org/content/lpc-character-bases\n\n- head/nose/button/amber.png: by Thane Brimhall (pennomi), Matthew Krohn (makrohn). License(s): GPL 3.0, CC-BY-SA 3.0. \n    - https://opengameart.org/content/lpc-base-character-expressions\n\n- eyes/male/gray.png: by Mark Weyer, Johannes Sjölund (wulax), Matthew Krohn (makrohn), Stephen Challener (Redshrike). License(s): CC-BY-SA 3.0, GPL 3.0. \n    - https://opengameart.org/content/liberated-pixel-cup-lpc-base-assets-sprites-map-tiles\n    - https://opengameart.org/content/lpc-medieval-fantasy-character-sprites\n\n- hair/lob/female/black.png: by bluecarrot16. License(s): CC0. \n    - https://opengameart.org/content/lpc-hair\n\n- dress/sash/female/pink.png: by bluecarrot16, Thane Brimhall (pennomi), laetissima, Matthew Krohn (makrohn). License(s): CC-BY-SA 3.0, GPL 3.0. \n    - https://opengameart.org/content/lpc-2-characters\n\n- legs/pants/female/leather.png: by bluecarrot16, David Conway Jr. (JaidynReiman), Joe White, Matthew Krohn (makrohn), Johannes Sjölund (wulax). License(s): GPL 3.0, CC-BY-SA 3.0. \n    - https://opengameart.org/content/liberated-pixel-cup-lpc-base-assets-sprites-map-tiles\n    - https://opengameart.org/content/lpc-medieval-fantasy-character-sprites\n    - http://opengameart.org/content/lpc-clothing-updates\n\n- feet/sandals/female/leather.png: by Nila122, David Conway Jr. (JaidynReiman), Matthew Krohn (makrohn), Johannes Sjölund (wulax). License(s): CC-BY-SA 3.0, GPL 2.0, GPL 3.0. \n    - https://opengameart.org/content/lpc-roman-armor\n    - http://opengameart.org/content/lpc-clothing-updates",
    "layers": [
      {
        "fileName": "body/bodies/female/universal/amber.png",
        "zPos": 10,
        "parentName": "body",
        "name": "Body color",
        "variant": "amber"
      },
      {
        "fileName": "feet/sandals/female/leather.png",
        "zPos": 15,
        "parentName": "shoes",
        "name": "Sandals",
        "variant": "leather"
      },
      {
        "fileName": "legs/pants/female/leather.png",
        "zPos": 20,
        "parentName": "legs",
        "name": "Pants",
        "variant": "leather"
      },
      {
        "fileName": "dress/sash/female/pink.png",
        "zPos": 30,
        "parentName": "dress",
        "name": "Sash dress",
        "variant": "pink"
      },
      {
        "fileName": "head/heads/human_female/universal/amber.png",
        "zPos": 100,
        "parentName": "head",
        "name": "Human female",
        "variant": "amber"
      },
      {
        "fileName": "head/nose/button/amber.png",
        "zPos": 105,
        "parentName": "nose",
        "name": "Button nose",
        "variant": "amber"
      },
      {
        "fileName": "eyes/male/gray.png",
        "zPos": 105,
        "parentName": "eyes",
        "name": "Eyes",
        "variant": "gray"
      },
      {
        "fileName": "hair/lob/female/black.png",
        "zPos": 120,
        "parentName": "hair",
        "name": "Lob",
        "variant": "black"
      }
    ]
  }