{
    "bodyTypeName": "female",
    "url": "https://sanderfrenken.github.io/Universal-LPC-Spritesheet-Character-Generator/#?body=Body_color_olive&head=Human_female_olive&hair=Long_messy_light_brown&clothes=Shortsleeve_green&legs=Pants_leather&shoes=Slippers_green&eyes=Eyes_gray&sex=female&cape=none&shoulders=none&jacket=none&beard=none&hat=none&jacket_collar=none&vest=none&dress=none&apron=none&nose=Button_nose_olive&neck=none&sash=none&belt=Leather_Belt_brown&ears=none&necklace=none",
    "spritesheets": "https://sanderfrenken.github.io/Universal-LPC-Spritesheet-Character-Generator/spritesheets/",
    "version": 1,
    "datetime": "10/23/2023, 12:18:39 PM",
    "credits": "Authors: Benjamin K. Smith (BenCreating), bluecarrot16, TheraHedwig, Evert, MuffinElZangano, Durrani, Pierre Vigier (pvigier), ElizaWy, Matthew Krohn (makrohn), Johannes Sjölund (wulax), Stephen Challener (Redshrike), Thane Brimhall (pennomi), Mark Weyer, Mandi Paugh, David Conway Jr. (JaidynReiman), Joe White, Luke Mehl\n\n- body/bodies/female/universal/olive.png: by Benjamin K. Smith (BenCreating), bluecarrot16, TheraHedwig, Evert, MuffinElZangano, Durrani, Pierre Vigier (pvigier), ElizaWy, Matthew Krohn (makrohn), Johannes Sjölund (wulax), Stephen Challener (Redshrike). License(s): OGA-BY 3.0, CC-BY-SA 3.0, GPL 3.0. \n    - https://opengameart.org/content/liberated-pixel-cup-lpc-base-assets-sprites-map-tiles\n    - https://opengameart.org/content/lpc-medieval-fantasy-character-sprites\n    - https://opengameart.org/content/lpc-ladies\n    - https://opengameart.org/content/lpc-7-womens-shirts\n    - https://opengameart.org/content/lpc-jump-expanded\n\n- head/heads/human_female/universal/olive.png: by bluecarrot16, Benjamin K. Smith (BenCreating), Stephen Challener (Redshrike). License(s): OGA-BY 3.0, CC-BY-SA 3.0, GPL 3.0. \n    - https://opengameart.org/content/\n    - https://opengameart.org/content/lpc-character-bases\n\n- head/nose/button/olive.png: by Thane Brimhall (pennomi), Matthew Krohn (makrohn). License(s): GPL 3.0, CC-BY-SA 3.0. \n    - https://opengameart.org/content/lpc-base-character-expressions\n\n- eyes/male/gray.png: by Mark Weyer, Johannes Sjölund (wulax), Matthew Krohn (makrohn), Stephen Challener (Redshrike). License(s): CC-BY-SA 3.0, GPL 3.0. \n    - https://opengameart.org/content/liberated-pixel-cup-lpc-base-assets-sprites-map-tiles\n    - https://opengameart.org/content/lpc-medieval-fantasy-character-sprites\n\n- hair/long_messy/female/light_brown.png: by Mandi Paugh, bluecarrot16. License(s): GPL 2.0, GPL 3.0, CC-BY 3.0. \n    - https://opengameart.org/content/puck-overland\n    - https://opengameart.org/content/lpc-hair\n\n- torso/clothes/shortsleeve/female/green.png: by bluecarrot16, ElizaWy, Stephen Challener (Redshrike). License(s): OGA-BY 3.0, CC-BY-SA 3.0, GPL 3.0. \n    - https://opengameart.org/content/liberated-pixel-cup-lpc-base-assets-sprites-map-tiles\n    - https://opengameart.org/content/lpc-7-womens-shirts\n    - http://opengameart.org/content/lpc-revised-character-basics\n    - http://opengameart.org/content/lpc-clothing-updates\n\n- torso/waist/belt_leather/female/brown.png: by bluecarrot16, Johannes Sjölund (wulax), Matthew Krohn (makrohn). License(s): CC-BY-SA 3.0, GPL 3.0. \n    - https://opengameart.org/content/lpc-combat-armor-for-women\n    - https://opengameart.org/content/lpc-pirates\n\n- legs/pants/female/leather.png: by bluecarrot16, David Conway Jr. (JaidynReiman), Joe White, Matthew Krohn (makrohn), Johannes Sjölund (wulax). License(s): GPL 3.0, CC-BY-SA 3.0. \n    - https://opengameart.org/content/liberated-pixel-cup-lpc-base-assets-sprites-map-tiles\n    - https://opengameart.org/content/lpc-medieval-fantasy-character-sprites\n    - http://opengameart.org/content/lpc-clothing-updates\n\n- feet/slippers/female/green.png: by bluecarrot16, Joe White, Luke Mehl. License(s): CC-BY-SA 3.0, GPL 3.0. \n    - https://opengameart.org/content/female-mage-clothing-set\n    - http://opengameart.org/content/lpc-clothing-updates",
    "layers": [
      {
        "fileName": "body/bodies/female/universal/olive.png",
        "zPos": 10,
        "parentName": "body",
        "name": "Body color",
        "variant": "olive"
      },
      {
        "fileName": "feet/slippers/female/green.png",
        "zPos": 15,
        "parentName": "shoes",
        "name": "Slippers",
        "variant": "green"
      },
      {
        "fileName": "legs/pants/female/leather.png",
        "zPos": 20,
        "parentName": "legs",
        "name": "Pants",
        "variant": "leather"
      },
      {
        "fileName": "torso/clothes/shortsleeve/female/green.png",
        "zPos": 35,
        "parentName": "clothes",
        "name": "Shortsleeve",
        "variant": "green"
      },
      {
        "fileName": "torso/waist/belt_leather/female/brown.png",
        "zPos": 70,
        "parentName": "belt",
        "name": "Leather Belt",
        "variant": "brown"
      },
      {
        "fileName": "head/heads/human_female/universal/olive.png",
        "zPos": 100,
        "parentName": "head",
        "name": "Human female",
        "variant": "olive"
      },
      {
        "fileName": "head/nose/button/olive.png",
        "zPos": 105,
        "parentName": "nose",
        "name": "Button nose",
        "variant": "olive"
      },
      {
        "fileName": "eyes/male/gray.png",
        "zPos": 105,
        "parentName": "eyes",
        "name": "Eyes",
        "variant": "gray"
      },
      {
        "fileName": "hair/long_messy/female/light_brown.png",
        "zPos": 120,
        "parentName": "hair",
        "name": "Long messy",
        "variant": "light brown"
      }
    ]
  }