{
    "bodyTypeName": "female",
    "url": "https://sanderfrenken.github.io/Universal-LPC-Spritesheet-Character-Generator/#?body=Body_color_light&head=Human_female_light&hair=Ponytail_blonde&clothes=none&legs=Pants_charcoal&shoes=Shoes_white&eyes=Eyes_gray&sex=female&cape=none&shoulders=none&jacket=none&beard=none&hat=none&jacket_collar=none&vest=Vest_open_blue&dress=Sash_dress_yellow&apron=none",
    "spritesheets": "https://sanderfrenken.github.io/Universal-LPC-Spritesheet-Character-Generator/spritesheets/",
    "version": 1,
    "datetime": "10/22/2023, 9:03:08 PM",
    "credits": "Authors: Benjamin K. Smith (BenCreating), bluecarrot16, TheraHedwig, Evert, MuffinElZangano, Durrani, Pierre Vigier (pvigier), ElizaWy, Matthew Krohn (makrohn), Johannes Sjölund (wulax), Stephen Challener (Redshrike), Mark Weyer, Manuel Riecke (MrBeast), Thane Brimhall (pennomi), laetissima, David Conway Jr. (JaidynReiman), Joe White\n\n- body/bodies/female/universal/light.png: by Benjamin K. Smith (BenCreating), bluecarrot16, TheraHedwig, Evert, MuffinElZangano, Durrani, Pierre Vigier (pvigier), ElizaWy, Matthew Krohn (makrohn), Johannes Sjölund (wulax), Stephen Challener (Redshrike). License(s): OGA-BY 3.0, CC-BY-SA 3.0, GPL 3.0. \n    - https://opengameart.org/content/liberated-pixel-cup-lpc-base-assets-sprites-map-tiles\n    - https://opengameart.org/content/lpc-medieval-fantasy-character-sprites\n    - https://opengameart.org/content/lpc-ladies\n    - https://opengameart.org/content/lpc-7-womens-shirts\n    - https://opengameart.org/content/lpc-jump-expanded\n\n- head/heads/human_female/universal/light.png: by bluecarrot16, Benjamin K. Smith (BenCreating), Stephen Challener (Redshrike). License(s): OGA-BY 3.0, CC-BY-SA 3.0, GPL 3.0. \n    - https://opengameart.org/content/\n    - https://opengameart.org/content/lpc-character-bases\n\n- eyes/male/gray.png: by Mark Weyer, Johannes Sjölund (wulax), Matthew Krohn (makrohn), Stephen Challener (Redshrike). License(s): CC-BY-SA 3.0, GPL 3.0. \n    - https://opengameart.org/content/liberated-pixel-cup-lpc-base-assets-sprites-map-tiles\n    - https://opengameart.org/content/lpc-medieval-fantasy-character-sprites\n\n- hair/ponytail/female/blonde.png: by Manuel Riecke (MrBeast). License(s): CC-BY-SA 3.0, GPL 3.0. \n    - https://opengameart.org/content/liberated-pixel-cup-lpc-base-assets-sprites-map-tiles\n\n- dress/sash/female/yellow.png: by bluecarrot16, Thane Brimhall (pennomi), laetissima, Matthew Krohn (makrohn). License(s): CC-BY-SA 3.0, GPL 3.0. \n    - https://opengameart.org/content/lpc-2-characters\n\n- legs/pants/female/charcoal.png: by bluecarrot16, David Conway Jr. (JaidynReiman), Joe White, Matthew Krohn (makrohn), Johannes Sjölund (wulax). License(s): GPL 3.0, CC-BY-SA 3.0. \n    - https://opengameart.org/content/liberated-pixel-cup-lpc-base-assets-sprites-map-tiles\n    - https://opengameart.org/content/lpc-medieval-fantasy-character-sprites\n    - http://opengameart.org/content/lpc-clothing-updates\n\n- feet/shoes/female/white.png: by Joe White, Johannes Sjölund (wulax). License(s): CC-BY-SA 3.0, GPL 3.0. \n    - https://opengameart.org/content/lpc-medieval-fantasy-character-sprites\n    - http://opengameart.org/content/lpc-clothing-updates",
    "layers": [
      {
        "fileName": "body/bodies/female/universal/light.png",
        "zPos": 10,
        "parentName": "body",
        "name": "Body color",
        "variant": "light"
      },
      {
        "fileName": "feet/shoes/female/white.png",
        "zPos": 15,
        "parentName": "shoes",
        "name": "Shoes",
        "variant": "white"
      },
      {
        "fileName": "legs/pants/female/charcoal.png",
        "zPos": 20,
        "parentName": "legs",
        "name": "Pants",
        "variant": "charcoal"
      },
      {
        "fileName": "dress/sash/female/yellow.png",
        "zPos": 30,
        "parentName": "dress",
        "name": "Sash dress",
        "variant": "yellow"
      },
      {
        "fileName": "head/heads/human_female/universal/light.png",
        "zPos": 100,
        "parentName": "head",
        "name": "Human female",
        "variant": "light"
      },
      {
        "fileName": "eyes/male/gray.png",
        "zPos": 105,
        "parentName": "eyes",
        "name": "Eyes",
        "variant": "gray"
      },
      {
        "fileName": "hair/ponytail/female/blonde.png",
        "zPos": 120,
        "parentName": "hair",
        "name": "Ponytail",
        "variant": "blonde"
      }
    ]
  }