{
    "bodyTypeName": "female",
    "url": "https://sanderfrenken.github.io/Universal-LPC-Spritesheet-Character-Generator/#?body=Body_color_light&head=Human_female_light&hair=Curtains_long_redhead&clothes=Longsleeve_charcoal&legs=Pants_black&shoes=Boots_black&eyes=Eyes_gray&sex=female&cape=none&shoulders=none&jacket=none&beard=none&hat=none&jacket_collar=none&vest=none&dress=none&apron=none&nose=Button_nose_light&neck=none&sash=none&belt=Leather_Belt_brown&ears=none&necklace=none",
    "spritesheets": "https://sanderfrenken.github.io/Universal-LPC-Spritesheet-Character-Generator/spritesheets/",
    "version": 1,
    "datetime": "10/23/2023, 12:16:01 PM",
    "credits": "Authors: Benjamin K. Smith (BenCreating), bluecarrot16, TheraHedwig, Evert, MuffinElZangano, Durrani, Pierre Vigier (pvigier), ElizaWy, Matthew Krohn (makrohn), Johannes Sjölund (wulax), Stephen Challener (Redshrike), Thane Brimhall (pennomi), Mark Weyer, Mandi Paugh, David Conway Jr. (JaidynReiman), Joe White, Nila122\n\n- body/bodies/female/universal/light.png: by Benjamin K. Smith (BenCreating), bluecarrot16, TheraHedwig, Evert, MuffinElZangano, Durrani, Pierre Vigier (pvigier), ElizaWy, Matthew Krohn (makrohn), Johannes Sjölund (wulax), Stephen Challener (Redshrike). License(s): OGA-BY 3.0, CC-BY-SA 3.0, GPL 3.0. \n    - https://opengameart.org/content/liberated-pixel-cup-lpc-base-assets-sprites-map-tiles\n    - https://opengameart.org/content/lpc-medieval-fantasy-character-sprites\n    - https://opengameart.org/content/lpc-ladies\n    - https://opengameart.org/content/lpc-7-womens-shirts\n    - https://opengameart.org/content/lpc-jump-expanded\n\n- head/heads/human_female/universal/light.png: by bluecarrot16, Benjamin K. Smith (BenCreating), Stephen Challener (Redshrike). License(s): OGA-BY 3.0, CC-BY-SA 3.0, GPL 3.0. \n    - https://opengameart.org/content/\n    - https://opengameart.org/content/lpc-character-bases\n\n- head/nose/button/light.png: by Thane Brimhall (pennomi), Matthew Krohn (makrohn). License(s): GPL 3.0, CC-BY-SA 3.0. \n    - https://opengameart.org/content/lpc-base-character-expressions\n\n- eyes/male/gray.png: by Mark Weyer, Johannes Sjölund (wulax), Matthew Krohn (makrohn), Stephen Challener (Redshrike). License(s): CC-BY-SA 3.0, GPL 3.0. \n    - https://opengameart.org/content/liberated-pixel-cup-lpc-base-assets-sprites-map-tiles\n    - https://opengameart.org/content/lpc-medieval-fantasy-character-sprites\n\n- hair/curtains_long/female/redhead.png: by Mandi Paugh, bluecarrot16. License(s): GPL 2.0, GPL 3.0, CC-BY 3.0. \n    - https://opengameart.org/content/trevor-overland\n    - https://opengameart.org/content/lpc-hair\n\n- torso/clothes/longsleeve/female/charcoal.png: by bluecarrot16, ElizaWy, Stephen Challener (Redshrike). License(s): OGA-BY 3.0, CC-BY-SA 3.0, GPL 3.0. \n    - https://opengameart.org/content/liberated-pixel-cup-lpc-base-assets-sprites-map-tiles\n    - https://opengameart.org/content/lpc-7-womens-shirts\n    - http://opengameart.org/content/lpc-clothing-updates\n\n- torso/waist/belt_leather/female/brown.png: by bluecarrot16, Johannes Sjölund (wulax), Matthew Krohn (makrohn). License(s): CC-BY-SA 3.0, GPL 3.0. \n    - https://opengameart.org/content/lpc-combat-armor-for-women\n    - https://opengameart.org/content/lpc-pirates\n\n- legs/pants/female/black.png: by bluecarrot16, David Conway Jr. (JaidynReiman), Joe White, Matthew Krohn (makrohn), Johannes Sjölund (wulax). License(s): GPL 3.0, CC-BY-SA 3.0. \n    - https://opengameart.org/content/liberated-pixel-cup-lpc-base-assets-sprites-map-tiles\n    - https://opengameart.org/content/lpc-medieval-fantasy-character-sprites\n    - http://opengameart.org/content/lpc-clothing-updates\n\n- feet/boots/female/black.png: by bluecarrot16, Nila122. License(s): OGA-BY 3.0, CC-BY-SA 3.0, GPL 2.0, GPL 3.0. \n    - https://opengameart.org/content/lpc-clothes-and-hair",
    "layers": [
      {
        "fileName": "body/bodies/female/universal/light.png",
        "zPos": 10,
        "parentName": "body",
        "name": "Body color",
        "variant": "light"
      },
      {
        "fileName": "legs/pants/female/black.png",
        "zPos": 20,
        "parentName": "legs",
        "name": "Pants",
        "variant": "black"
      },
      {
        "fileName": "feet/boots/female/black.png",
        "zPos": 25,
        "parentName": "shoes",
        "name": "Boots",
        "variant": "black"
      },
      {
        "fileName": "torso/clothes/longsleeve/female/charcoal.png",
        "zPos": 35,
        "parentName": "clothes",
        "name": "Longsleeve",
        "variant": "charcoal"
      },
      {
        "fileName": "torso/waist/belt_leather/female/brown.png",
        "zPos": 70,
        "parentName": "belt",
        "name": "Leather Belt",
        "variant": "brown"
      },
      {
        "fileName": "head/heads/human_female/universal/light.png",
        "zPos": 100,
        "parentName": "head",
        "name": "Human female",
        "variant": "light"
      },
      {
        "fileName": "head/nose/button/light.png",
        "zPos": 105,
        "parentName": "nose",
        "name": "Button nose",
        "variant": "light"
      },
      {
        "fileName": "eyes/male/gray.png",
        "zPos": 105,
        "parentName": "eyes",
        "name": "Eyes",
        "variant": "gray"
      },
      {
        "fileName": "hair/curtains_long/female/redhead.png",
        "zPos": 120,
        "parentName": "hair",
        "name": "Curtains long",
        "variant": "redhead"
      }
    ]
  }