{
    "bodyTypeName": "male",
    "url": "https://sanderfrenken.github.io/Universal-LPC-Spritesheet-Character-Generator/#?body=Body_color_light&head=Human_male_light&hair=Plain_blonde&clothes=Longsleeve_blue&legs=Pants_leather&shoes=Shoes_white",
    "spritesheets": "https://sanderfrenken.github.io/Universal-LPC-Spritesheet-Character-Generator/spritesheets/",
    "version": 1,
    "datetime": "10/22/2023, 8:36:37 PM",
    "credits": "Authors: bluecarrot16, Benjamin K. Smith (BenCreating), Evert, Eliza Wyatt (ElizaWy), TheraHedwig, MuffinElZangano, Durrani, Johannes Sj?lund (wulax), Stephen Challener (Redshrike), Manuel Riecke (MrBeast), Joe White, David Conway Jr. (JaidynReiman), Johannes Sjölund (wulax), Matthew Krohn (makrohn)\n\n- body/bodies/male/universal/light.png: by bluecarrot16, Benjamin K. Smith (BenCreating), Evert, Eliza Wyatt (ElizaWy), TheraHedwig, MuffinElZangano, Durrani, Johannes Sj?lund (wulax), Stephen Challener (Redshrike). License(s): CC-BY-SA 3.0, GPL 3.0. \n    - https://opengameart.org/content/liberated-pixel-cup-lpc-base-assets-sprites-map-tiles\n    - https://opengameart.org/content/lpc-medieval-fantasy-character-sprites\n    - https://opengameart.org/content/lpc-male-jumping-animation-by-durrani\n    - https://opengameart.org/content/lpc-runcycle-and-diagonal-walkcycle\n    - https://opengameart.org/content/lpc-revised-character-basics\n\n- head/heads/human_male/universal/light.png: by bluecarrot16, Benjamin K. Smith (BenCreating), Stephen Challener (Redshrike). License(s): OGA-BY 3.0, CC-BY-SA 3.0, GPL 3.0. \n    - https://opengameart.org/content/liberated-pixel-cup-lpc-base-assets-sprites-map-tiles\n    - https://opengameart.org/content/lpc-character-bases\n\n- hair/plain/male/blonde.png: by Manuel Riecke (MrBeast), Joe White. License(s): CC-BY-SA 3.0, GPL 3.0. \n    - https://opengameart.org/content/liberated-pixel-cup-lpc-base-assets-sprites-map-tiles\n    - https://opengameart.org/content/ponytail-and-plain-hairstyles\n\n- torso/clothes/longsleeve/male/blue.png: by David Conway Jr. (JaidynReiman), Johannes Sjölund (wulax). License(s): CC-BY-SA 3.0, GPL 3.0. \n    - https://opengameart.org/content/lpc-medieval-fantasy-character-sprites\n    - http://opengameart.org/content/lpc-clothing-updates\n\n- legs/pants/male/leather.png: by bluecarrot16, David Conway Jr. (JaidynReiman), Joe White, Matthew Krohn (makrohn), Johannes Sjölund (wulax). License(s): CC-BY-SA 3.0, GPL 3.0. \n    - https://opengameart.org/content/liberated-pixel-cup-lpc-base-assets-sprites-map-tiles\n    - https://opengameart.org/content/lpc-medieval-fantasy-character-sprites\n\n- feet/shoes/male/white.png: by bluecarrot16, Johannes Sjölund (wulax). License(s): CC-BY-SA 3.0, GPL 3.0. \n    - https://opengameart.org/content/lpc-medieval-fantasy-character-sprites\n    - http://opengameart.org/content/lpc-clothing-updates",
    "layers": [
      {
        "fileName": "body/bodies/male/universal/light.png",
        "zPos": 10,
        "parentName": "body",
        "name": "Body color",
        "variant": "light"
      },
      {
        "fileName": "feet/shoes/male/white.png",
        "zPos": 15,
        "parentName": "shoes",
        "name": "Shoes",
        "variant": "white"
      },
      {
        "fileName": "legs/pants/male/leather.png",
        "zPos": 20,
        "parentName": "legs",
        "name": "Pants",
        "variant": "leather"
      },
      {
        "fileName": "torso/clothes/longsleeve/male/blue.png",
        "zPos": 35,
        "parentName": "clothes",
        "name": "Longsleeve",
        "variant": "blue"
      },
      {
        "fileName": "head/heads/human_male/universal/light.png",
        "zPos": 100,
        "parentName": "head",
        "name": "Human male",
        "variant": "light"
      },
      {
        "fileName": "hair/plain/male/blonde.png",
        "zPos": 120,
        "parentName": "hair",
        "name": "Plain",
        "variant": "blonde"
      }
    ]
  }