{
  "bodyTypeName": "male",
  "url": "https://sanderfrenken.github.io/Universal-LPC-Spritesheet-Character-Generator/#?body=Body_color_light&head=Human_male_light&hair=High_and_tight_black&clothes=Longsleeve_walnut&legs=Pantaloons_black&shoes=Shoes_white&eyes=Eyes_green",
  "spritesheets": "https://sanderfrenken.github.io/Universal-LPC-Spritesheet-Character-Generator/spritesheets/",
  "version": 1,
  "datetime": "10/22/2023, 8:40:35 PM",
  "credits": "Authors: bluecarrot16, Benjamin K. Smith (BenCreating), Evert, Eliza Wyatt (ElizaWy), TheraHedwig, MuffinElZangano, Durrani, Johannes Sj?lund (wulax), Stephen Challener (Redshrike), Matthew Krohn (makrohn), Skorpio, David Conway Jr. (JaidynReiman), Johannes Sjölund (wulax), Nila122\n\n- body/bodies/male/universal/light.png: by bluecarrot16, Benjamin K. Smith (BenCreating), Evert, Eliza Wyatt (ElizaWy), TheraHedwig, MuffinElZangano, Durrani, Johannes Sj?lund (wulax), Stephen Challener (Redshrike). License(s): CC-BY-SA 3.0, GPL 3.0. \n    - https://opengameart.org/content/liberated-pixel-cup-lpc-base-assets-sprites-map-tiles\n    - https://opengameart.org/content/lpc-medieval-fantasy-character-sprites\n    - https://opengameart.org/content/lpc-male-jumping-animation-by-durrani\n    - https://opengameart.org/content/lpc-runcycle-and-diagonal-walkcycle\n    - https://opengameart.org/content/lpc-revised-character-basics\n\n- head/heads/human_male/universal/light.png: by bluecarrot16, Benjamin K. Smith (BenCreating), Stephen Challener (Redshrike). License(s): OGA-BY 3.0, CC-BY-SA 3.0, GPL 3.0. \n    - https://opengameart.org/content/liberated-pixel-cup-lpc-base-assets-sprites-map-tiles\n    - https://opengameart.org/content/lpc-character-bases\n\n- eyes/male/green.png: by Matthew Krohn (makrohn), Stephen Challener (Redshrike). License(s): CC-BY-SA 3.0, GPL 3.0. \n    - https://opengameart.org/content/liberated-pixel-cup-lpc-base-assets-sprites-map-tiles\n\n- hair/high_and_tight/male/black.png: by Skorpio, bluecarrot16. License(s): CC-BY-SA 3.0, GPL 3.0. \n    - https://opengameart.org/content/lpc-skorpios-scifi-sprite-pack\n    - https://opengameart.org/content/lpc-hair\n\n- torso/clothes/longsleeve/male/walnut.png: by David Conway Jr. (JaidynReiman), Johannes Sjölund (wulax). License(s): CC-BY-SA 3.0, GPL 3.0. \n    - https://opengameart.org/content/lpc-medieval-fantasy-character-sprites\n    - http://opengameart.org/content/lpc-clothing-updates\n\n- legs/pantaloons/male/black.png: by Nila122, Johannes Sjölund (wulax), Stephen Challener (Redshrike). License(s): CC-BY-SA 3.0, GPL 2.0, GPL 3.0. \n    - https://opengameart.org/content/lpc-pirates\n    - https://opengameart.org/content/more-lpc-clothes-and-hair\n\n- feet/shoes/male/white.png: by bluecarrot16, Johannes Sjölund (wulax). License(s): CC-BY-SA 3.0, GPL 3.0. \n    - https://opengameart.org/content/lpc-medieval-fantasy-character-sprites\n    - http://opengameart.org/content/lpc-clothing-updates",
  "layers": [
    {
      "fileName": "body/bodies/male/universal/light.png",
      "zPos": 10,
      "parentName": "body",
      "name": "Body color",
      "variant": "light"
    },
    {
      "fileName": "feet/shoes/male/white.png",
      "zPos": 15,
      "parentName": "shoes",
      "name": "Shoes",
      "variant": "white"
    },
    {
      "fileName": "legs/pantaloons/male/black.png",
      "zPos": 20,
      "parentName": "legs",
      "name": "Pantaloons",
      "variant": "black"
    },
    {
      "fileName": "torso/clothes/longsleeve/male/walnut.png",
      "zPos": 35,
      "parentName": "clothes",
      "name": "Longsleeve",
      "variant": "walnut"
    },
    {
      "fileName": "head/heads/human_male/universal/light.png",
      "zPos": 100,
      "parentName": "head",
      "name": "Human male",
      "variant": "light"
    },
    {
      "fileName": "eyes/male/green.png",
      "zPos": 105,
      "parentName": "eyes",
      "name": "Eyes",
      "variant": "green"
    },
    {
      "fileName": "hair/high_and_tight/male/black.png",
      "zPos": 120,
      "parentName": "hair",
      "name": "High and tight",
      "variant": "black"
    }
  ]
}