{
  "bodyTypeName": "muscular",
  "url": "https://sanderfrenken.github.io/Universal-LPC-Spritesheet-Character-Generator/#?body=Body_color_light&head=Human_male_light&hair=Messy2_ash&clothes=Longsleeve_walnut&legs=Wide_pants_brown&shoes=Shoes_navy&eyes=Eyes_blue&sex=muscular&cape=none&shoulders=none",
  "spritesheets": "https://sanderfrenken.github.io/Universal-LPC-Spritesheet-Character-Generator/spritesheets/",
  "version": 1,
  "datetime": "10/22/2023, 8:43:07 PM",
  "credits": "Authors: bluecarrot16, Evert, TheraHedwig, MuffinElZangano, Durrani, Sander Frenken (castelonia), Benjamin K. Smith (BenCreating), Eliza Wyatt (ElizaWy), dalonedrau, Stephen Challener (Redshrike), Matthew Krohn (makrohn), Manuel Riecke (MrBeast), Nila122, Johannes Sjölund (wulax)\n\n- body/bodies/muscular/universal/light.png: by bluecarrot16, Evert, TheraHedwig, MuffinElZangano, Durrani, Sander Frenken (castelonia), Benjamin K. Smith (BenCreating), Eliza Wyatt (ElizaWy), dalonedrau, Stephen Challener (Redshrike). License(s): CC-BY-SA 3.0. \n    - https://opengameart.org/content/liberated-pixel-cup-lpc-base-assets-sprites-map-tiles\n    - https://opengameart.org/content/lpc-barbarian-sprite-base\n    - https://opengameart.org/content/lpc-muscular-swing-animation\n    - https://opengameart.org/content/lpc-muscular-hurt-animation\n    - https://opengameart.org/content/lpc-jump-expanded\n\n- head/heads/human_male/universal/light.png: by bluecarrot16, Benjamin K. Smith (BenCreating), Stephen Challener (Redshrike). License(s): OGA-BY 3.0, CC-BY-SA 3.0, GPL 3.0. \n    - https://opengameart.org/content/liberated-pixel-cup-lpc-base-assets-sprites-map-tiles\n    - https://opengameart.org/content/lpc-character-bases\n\n- eyes/male/blue.png: by Matthew Krohn (makrohn), Stephen Challener (Redshrike). License(s): CC-BY-SA 3.0, GPL 3.0. \n    - https://opengameart.org/content/liberated-pixel-cup-lpc-base-assets-sprites-map-tiles\n\n- hair/messy2/male/ash.png: by Manuel Riecke (MrBeast). License(s): CC-BY-SA 3.0, GPL 3.0. \n    - https://opengameart.org/content/liberated-pixel-cup-lpc-base-assets-sprites-map-tiles\n\n- legs/pants/muscular/brown.png: by Nila122, Johannes Sjölund (wulax), Stephen Challener (Redshrike). License(s): CC-BY-SA 3.0, GPL 2.0, GPL 3.0. \n    - https://opengameart.org/content/more-lpc-clothes-and-hair\n\n- feet/shoes/male/navy.png: by bluecarrot16, Johannes Sjölund (wulax). License(s): CC-BY-SA 3.0, GPL 3.0. \n    - https://opengameart.org/content/lpc-medieval-fantasy-character-sprites\n    - http://opengameart.org/content/lpc-clothing-updates",
  "layers": [
    {
      "fileName": "body/bodies/muscular/universal/light.png",
      "zPos": 10,
      "parentName": "body",
      "name": "Body color",
      "variant": "light"
    },
    {
      "fileName": "feet/shoes/male/navy.png",
      "zPos": 15,
      "parentName": "shoes",
      "name": "Shoes",
      "variant": "navy"
    },
    {
      "fileName": "legs/pants/muscular/brown.png",
      "zPos": 20,
      "parentName": "legs",
      "name": "Wide pants",
      "variant": "brown"
    },
    {
      "fileName": "head/heads/human_male/universal/light.png",
      "zPos": 100,
      "parentName": "head",
      "name": "Human male",
      "variant": "light"
    },
    {
      "fileName": "eyes/male/blue.png",
      "zPos": 105,
      "parentName": "eyes",
      "name": "Eyes",
      "variant": "blue"
    },
    {
      "fileName": "hair/messy2/male/ash.png",
      "zPos": 120,
      "parentName": "hair",
      "name": "Messy2",
      "variant": "ash"
    }
  ]
}