{
    "bodyTypeName": "male",
    "url": "https://sanderfrenken.github.io/Universal-LPC-Spritesheet-Character-Generator/#?body=Body_color_olive&head=Human_male_olive&hair=Idol_white&clothes=Longsleeve_charcoal&legs=Pants_blue&shoes=Shoes_sky&eyes=Eyes_gray&sex=male&cape=none&shoulders=none&jacket=Trench_coat_gray&beard=none&hat=none&jacket_collar=none&vest=none&neck=Scarf_white&facial=Facial_sunglasses",
    "spritesheets": "https://sanderfrenken.github.io/Universal-LPC-Spritesheet-Character-Generator/spritesheets/",
    "version": 1,
    "datetime": "10/23/2023, 12:12:20 PM",
    "credits": "Authors: bluecarrot16, Benjamin K. Smith (BenCreating), Evert, Eliza Wyatt (ElizaWy), TheraHedwig, MuffinElZangano, Durrani, Johannes Sj?lund (wulax), Stephen Challener (Redshrike), Mark Weyer, Johannes Sjölund (wulax), Matthew Krohn (makrohn), thecilekli, Michael Whitlock (bigbeargames), Thane Brimhall (pennomi), Nila122, David Conway Jr. (JaidynReiman), Joe White\n\n- body/bodies/male/universal/olive.png: by bluecarrot16, Benjamin K. Smith (BenCreating), Evert, Eliza Wyatt (ElizaWy), TheraHedwig, MuffinElZangano, Durrani, Johannes Sj?lund (wulax), Stephen Challener (Redshrike). License(s): CC-BY-SA 3.0, GPL 3.0. \n    - https://opengameart.org/content/liberated-pixel-cup-lpc-base-assets-sprites-map-tiles\n    - https://opengameart.org/content/lpc-medieval-fantasy-character-sprites\n    - https://opengameart.org/content/lpc-male-jumping-animation-by-durrani\n    - https://opengameart.org/content/lpc-runcycle-and-diagonal-walkcycle\n    - https://opengameart.org/content/lpc-revised-character-basics\n\n- head/heads/human_male/universal/olive.png: by bluecarrot16, Benjamin K. Smith (BenCreating), Stephen Challener (Redshrike). License(s): OGA-BY 3.0, CC-BY-SA 3.0, GPL 3.0. \n    - https://opengameart.org/content/liberated-pixel-cup-lpc-base-assets-sprites-map-tiles\n    - https://opengameart.org/content/lpc-character-bases\n\n- eyes/male/gray.png: by Mark Weyer, Johannes Sjölund (wulax), Matthew Krohn (makrohn), Stephen Challener (Redshrike). License(s): CC-BY-SA 3.0, GPL 3.0. \n    - https://opengameart.org/content/liberated-pixel-cup-lpc-base-assets-sprites-map-tiles\n    - https://opengameart.org/content/lpc-medieval-fantasy-character-sprites\n\n- hair/idol/male/white.png: by thecilekli, bluecarrot16. License(s): CC0. \n    - https://opengameart.org/content/lpc-korean-idol-hairstyle-male-with-12-colors\n    - https://opengameart.org/content/lpc-hair\n\n- facial/sunglasses.png: by Michael Whitlock (bigbeargames), Thane Brimhall (pennomi). License(s): CC-BY-SA 3.0, GPL 3.0. \n    - https://opengameart.org/content/lpc-base-character-expressions\n\n- neck/scarf/white.png: by Nila122, Johannes Sjölund (wulax), Stephen Challener (Redshrike). License(s): CC-BY-SA 3.0, GPL 2.0, GPL 3.0. \n    - https://opengameart.org/content/more-lpc-clothes-and-hair\n\n- torso/clothes/longsleeve/male/charcoal.png: by David Conway Jr. (JaidynReiman), Johannes Sjölund (wulax). License(s): CC-BY-SA 3.0, GPL 3.0. \n    - https://opengameart.org/content/lpc-medieval-fantasy-character-sprites\n    - http://opengameart.org/content/lpc-clothing-updates\n\n- torso/jacket/trench/male/gray.png: by bluecarrot16. License(s): CC-BY-SA 3.0, GPL 3.0. \n    - https://opengameart.org/content/lpc-gentleman\n\n- legs/pants/male/blue.png: by bluecarrot16, David Conway Jr. (JaidynReiman), Joe White, Matthew Krohn (makrohn), Johannes Sjölund (wulax). License(s): CC-BY-SA 3.0, GPL 3.0. \n    - https://opengameart.org/content/liberated-pixel-cup-lpc-base-assets-sprites-map-tiles\n    - https://opengameart.org/content/lpc-medieval-fantasy-character-sprites\n\n- feet/shoes/male/sky.png: by bluecarrot16, Johannes Sjölund (wulax). License(s): CC-BY-SA 3.0, GPL 3.0. \n    - https://opengameart.org/content/lpc-medieval-fantasy-character-sprites\n    - http://opengameart.org/content/lpc-clothing-updates",
    "layers": [
      {
        "fileName": "body/bodies/male/universal/olive.png",
        "zPos": 10,
        "parentName": "body",
        "name": "Body color",
        "variant": "olive"
      },
      {
        "fileName": "feet/shoes/male/sky.png",
        "zPos": 15,
        "parentName": "shoes",
        "name": "Shoes",
        "variant": "sky"
      },
      {
        "fileName": "legs/pants/male/blue.png",
        "zPos": 20,
        "parentName": "legs",
        "name": "Pants",
        "variant": "blue"
      },
      {
        "fileName": "torso/clothes/longsleeve/male/charcoal.png",
        "zPos": 35,
        "parentName": "clothes",
        "name": "Longsleeve",
        "variant": "charcoal"
      },
      {
        "fileName": "torso/jacket/trench/male/gray.png",
        "zPos": 55,
        "parentName": "jacket",
        "name": "Trench coat",
        "variant": "gray"
      },
      {
        "fileName": "neck/scarf/white.png",
        "zPos": 90,
        "parentName": "neck",
        "name": "Scarf",
        "variant": "white"
      },
      {
        "fileName": "head/heads/human_male/universal/olive.png",
        "zPos": 100,
        "parentName": "head",
        "name": "Human male",
        "variant": "olive"
      },
      {
        "fileName": "eyes/male/gray.png",
        "zPos": 105,
        "parentName": "eyes",
        "name": "Eyes",
        "variant": "gray"
      },
      {
        "fileName": "facial/sunglasses.png",
        "zPos": 115,
        "parentName": "facial",
        "name": "Facial",
        "variant": "sunglasses"
      },
      {
        "fileName": "hair/idol/male/white.png",
        "zPos": 120,
        "parentName": "hair",
        "name": "Idol",
        "variant": "white"
      }
    ]
  }